{
  "$schema": "https://json-schema.org/draft/2020-12/schema",
  "$id": "https://fabio-ara.github.io/AraLearn/authoring/schemas/rebuild.schema.json",
  "title": "Pedido de reconstrução",
  "type": "object",
  "required": ["artifact", "version", "runId", "partKey", "targetSha256", "reason", "requiredChanges", "sameSpecification", "preserveEntityIds"],
  "properties": {
    "artifact": { "const": "aralearn.rebuild" },
    "version": { "const": 1 },
    "runId": { "$ref": "common.schema.json#/$defs/uuid" },
    "partKey": { "$ref": "common.schema.json#/$defs/partKey" },
    "targetSha256": { "$ref": "common.schema.json#/$defs/hash" },
    "reason": { "enum": ["contract", "fragment_structure", "didactics", "continuity", "source_use", "language", "resources"] },
    "requiredChanges": {
      "type": "array",
      "minItems": 1,
      "items": { "$ref": "common.schema.json#/$defs/nonEmptyText" }
    },
    "sameSpecification": { "const": true },
    "preserveEntityIds": { "const": true }
  },
  "additionalProperties": false
}
